{
  "$schema": "http://json-schema.org/draft-07/schema#",
  "type": "object",
  "required": ["key", "name", "version"],
  "properties": {
    "key": {"type": "string"},
    "name": {"type": "string"},
    "version": {"type": "string"},
    "type": {"type": "string"},
    "entry": {"type": "string"},
    "workflows": {"type": "array", "items": {"type": "string"}},
    "documents": {"type": "array", "items": {"type": "string"}},
    "regulations": {"type": "array", "items": {"type": "string"}},
    "integrations": {"type": "array", "items": {"type": "string"}},
    "modules": {"type": "array", "items": {"type": "string"}},
    "plans": {"type": "array", "items": {"type": "string"}},
    "roboConnector": {"type": "boolean"},
    "roboAssistant": {"type": "boolean"},
    "flowBeaconAi": {"type": "boolean"},
    "available": {"type": "boolean"},
    "price": {
      "type": "object",
      "properties": {
        "credits": {"type": "number"}
      },
      "additionalProperties": true
    },
    "tags": {"type": "array", "items": {"type": "string"}},
    "license": {"type": "string"},
    "description": {"type": "string"}
  },
  "additionalProperties": true
}
